field,#,sea,status,HC type,PL/BAA,operator,HPHT,res. quality,reservoir,group,formation,lithology,recovery,FactPageUrl,rec. oil,rec. gas,rec. ass. liq.,rec. OE,rem. oil,rem. gas,rem. ass. liq.,rem. OE,rem. OE prod. years,STOIIP,GIIP,in-place ass. liquid,in-place ass. gas,in-place free gas,in-place OE,in-place liq./OE ratio,in-place free gas/OE ratio,RF oil,RF liq.,RF gas,maturity oil,maturity gas,maturity liq.,maturity OE,peak year,peak OE YPR,peak oil YPR,peak gas YPR,well num,prod. num,inj. num,obs. num,lat,lon,depth min,depth mean,depth median,depth max,water depth,depth,p_h,p0,grad_p0,p0 checked,T0,GOR,oil FVF,gas FVF,oil PV0,gas PV0,HCPV0,gas PV0/HC PV0,rec. oil PV,rec. gas PV,rec. HCPV,CO2 SC,H2 SC,CO2 SC/well num,CO2 density RC,q_resv,qi_resv,q_gas,qi_gas,q_gas2,q_resv2,total score
ALBUSKJELL,0,NORTH,shut down,gas/oil,018,ConocoPhillips Skandinavia AS,True,,"Albuskjell produced gas and condensate from Maastrichtian and lower Paleocene chalk. The accumulation is located above a salt dome. The main reservoir is in the Upper Cretaceous Tor Formation, at a depth of 3200 metres. The overlying Ekofisk Formation has poorer reservoir quality and has hardly been drained. There are significant remaining resources.",Shetland,"Tor, Ekofisk",carbonate,The field was produced by pressure depletion.,https://factpages.sodir.no/factpages/default.aspx?nav1=field&nav2=PageView|All&nav3=43437,7.35,15.53,1.88,24.76,0.0,0.0,0.0,0.0,,56.0,56.0,40.0,0.0,56.0,152.0,0.63,0.368,0.131,0.096,0.2773,1.0,1.0,1.0,1.0,1981.0,3.943,1.694,2.249,20.0,20.0,0.0,0.0,56.63154659999999,2.99692745,3295.4,3411.8,3411.8,4132.0,69.0,3204.4,345.7,499.9,155.7,True,130.0,263.5,1.7325944650681833,0.0033697177920364884,97.03,188.7,285.73,0.66,9.33,52.33,61.66,45.45,1.49,2.27,737.0,1013.0,,,,0.37,1490.0,0.0
ALVE,1,NORWEGIAN,producing,gas/oil,159 B,Equinor Energy AS,False,,"Alve produces oil and gas from sandstone of Early and Middle Jurassic age in the Tilje, Not and Garn Formations. The reservoir is at a depth of 3600 metres and has moderate to good quality.","Båt, Fangst","Tilje, Not, Garn",clastic,The field is produced by pressure depletion.,https://factpages.sodir.no/factpages/default.aspx?nav1=field&nav2=PageView|All&nav3=4444332,2.62,11.99,3.5,18.11,0.33,3.0,0.78,4.11,5.1,5.0,19.0,6.0,2.0,17.0,32.0,0.34,0.531,0.524,0.556,0.6311,0.874,0.75,0.819,0.773,2009.0,1.472,0.572,0.9,5.0,4.0,0.0,1.0,65.96845640000001,7.810056,3585.0,3742.0,3742.0,3841.0,368.0,3771.0,384.9,384.9,101.8,False,133.2,400.0,2.093088597454005,0.004052434681544144,10.47,68.89,79.36,0.87,5.82,43.47,49.29,31.52,0.96,6.3,639.0,4267.0,,,,2.64,11499.0,0.0
ALVE NORD,2,NORWEGIAN,approved,gas/oil,127 C,Aker BP ASA,False,,"The reservoirs contain oil and gas in the Lower Jurassic Båt Group and the Middle Jurassic Fangst Group, and gas in the Early Cretaceous Lange Formation. The Lange Formation reservoir is at a depth of 3000 metres and the Jurassic reservoirs at about 3600-4000 metres. The reservoir properties are varying.","Båt, Fangst, Cromer Knoll",Lange,clastic,The field will be produced by pressure depletion.,https://factpages.sodir.no/factpages/default.aspx?nav1=field&nav2=PageView|All&nav3=42002483,1.55,4.15,1.12,6.82,1.55,4.15,1.12,6.82,,17.0,18.0,5.0,4.0,14.0,44.0,0.5,0.318,0.091,0.121,0.2306,0.0,0.0,0.0,0.0,,,,,1.0,0.0,0.0,0.0,66.021664,7.863972,4245.0,4245.0,4245.0,4245.0,369.0,4245.0,433.2,433.2,101.8,False,149.0,235.3,1.6766277295071874,0.003892056171632054,28.5,54.49,82.99,0.66,3.46,12.56,16.02,10.24,0.33,10.24,639.0,,,,,,,0.0
ALVHEIM,3,NORTH,producing,oil/gas,203,Aker BP ASA,False,,"Alvheim produces oil and gas from Paleocene sandstone in the Hermod and Heimdal Formations. The reservoirs are located in submarine fan deposits and injectites, mostly at depths of 2100-2200 metres. The reservoir quality is good.",Rogaland,"Hermod, Heimdal",clastic,The field is produced by natural water drive from an underlying aquifer.,https://factpages.sodir.no/factpages/default.aspx?nav1=field&nav2=PageView|All&nav3=2845712,62.78,17.19,0.0,79.97,11.5,8.85,0.0,20.35,,124.0,32.0,1.0,12.0,20.0,169.0,0.74,0.118,0.506,0.502,0.5372,0.817,0.485,0.817,0.746,2009.0,5.422,4.986,0.436,79.0,50.0,2.0,27.0,59.56344594936707,1.991395746835443,1153.0,2113.2,2113.2,2341.0,121.6,2132.0,218.1,218.1,101.8,False,78.4,96.8,1.2423188775539065,0.005291011926598488,154.05,105.82,259.87,0.41,77.37,56.85,134.22,86.22,1.81,1.09,642.0,2247.0,7829.0,,0.0,,939.0,0.0
ATLA,4,NORTH,shut down,gas,102 C,TotalEnergies EP Norge AS,False,,Atla produced gas from Middle Jurassic sandstone in the Brent Group. The reservoir is at a depth of 2700 metres and has good quality.,Brent,Brent,clastic,The field was produced by pressure depletion.,https://factpages.sodir.no/factpages/default.aspx?nav1=field&nav2=PageView|All&nav3=21106284,0.28,1.48,0.0,1.76,0.0,0.0,0.0,0.0,0.0,0.0,2.0,0.0,0.0,2.0,2.0,0.0,1.0,,inf,0.74,,1.0,1.0,1.0,2016.0,0.488,0.022,0.465,1.0,1.0,0.0,0.0,59.662017,2.570942,2695.0,2695.0,2695.0,2695.0,119.0,2695.0,275.4,404.5,149.7,True,97.2,,0.0,0.0035076428601160583,0.0,7.02,7.02,1.0,0.0,5.19,5.19,3.99,0.11,3.99,769.0,1743.0,,,,1.27,4480.0,0.0
BALDER,5,NORTH,producing,oil,001,Vår Energi ASA,False,,"Balder, including Ringhorne, produces oil from several separate deposits in sandstone of Jurassic, Paleocene and Eocene age. Balder produces from the Heimdal and Hermod Formations as well as from the injected sand complex above them. Ringhorne produces from the Hugin, Ty and Hermod Formations. The reservoirs are of good to very good quality. The Balder reservoir is at a depth of 1700 metres and the Ringhorne reservoir at a depth of 1,900 metres.","Rogaland, Vestland","Heimdal, Hermod, Hugin, Ty",clastic,"Balder and Ringhorne produce primarily by natural aquifer drive, but reinjection of produced water is used for pressure support, especially into the Ringhorne Jurassic reservoir. Excess water is injected into the Utsira Formation. Gas is also reinjected if the gas export system is down.",https://factpages.sodir.no/factpages/default.aspx?nav1=field&nav2=PageView|All&nav3=43562,102.33,2.63,0.0,104.96,27.36,0.68,0.0,28.04,,280.0,15.0,0.0,15.0,0.0,310.0,0.9,0.0,0.365,0.365,0.1753,0.733,0.741,0.733,0.733,2005.0,7.239,6.984,0.254,95.0,48.0,14.0,33.0,59.222214799999996,2.412242336842105,891.0,1794.7,1794.7,2252.7,127.2,1765.0,180.7,180.7,101.8,False,66.2,53.6,1.1286824918905074,0.005974186154762831,316.03,0.0,316.03,0.0,115.5,0.0,115.5,74.21,1.36,0.78,643.0,1349.0,3919.0,,52052.0,,1186.0,0.0
BAUGE,6,NORWEGIAN,producing,oil,348,Equinor Energy AS,False,,"The main reservoirs contain oil in Lower and Middle Jurassic sandstone in the Tilje and Ile Formations, at a depth of 2700 metres. They are segmented and have moderate quality.","Båt, Fangst","Tilje, Ile",clastic,The field is produced by pressure depletion. Pressure maintenance with water injection is planned to start few years after production start-up.,https://factpages.sodir.no/factpages/default.aspx?nav1=field&nav2=PageView|All&nav3=29446221,4.12,1.3,1.35,6.77,3.78,1.23,1.31,6.32,,16.0,5.0,0.0,5.0,0.0,26.0,0.62,0.0,0.258,0.342,0.26,0.083,0.054,0.069,0.066,2023.0,0.371,0.307,0.064,2.0,2.0,0.0,0.0,64.355046,7.4616225,2987.1,3030.1,3030.1,3073.1,281.5,3030.1,309.5,309.5,101.8,False,108.4,312.5,1.8407037703536662,0.004418216337638376,29.45,0.0,29.45,0.0,10.07,0.0,10.07,6.45,0.17,3.22,641.0,,,,,,585.0,0.0
BERLING,7,NORWEGIAN,approved,gas,644 B,OMV (Norge) AS,True,,Berling contains gas and condensate. The Berling Garn reservoir is in the Middle Jurassic Garn Formation. It is at a depth of 4100 metres and has high pressure and high temperature (HPHT). The reservoir is structurally complex and has varying reservoir quality. The Berling Breiflabb reservoir is in intra-Lange Formation turbidite sandstone of Late Cretaceous age at a depth of 3900 metres.,"Fangst, Cromer Knoll","Garn, intra-Lange",clastic,The field will be produced by pressure depletion.,https://factpages.sodir.no/factpages/default.aspx?nav1=field&nav2=PageView|All&nav3=42002473,1.53,4.58,1.41,7.52,1.53,4.58,1.41,7.52,,0.0,15.0,3.0,0.0,15.0,18.0,0.17,0.833,,0.979,0.3053,,0.0,0.0,0.0,,,,,5.0,0.0,0.0,0.0,65.1999608,6.3860252,1440.0,3606.0,4236.0,4513.0,377.0,4236.0,432.2,633.0,149.2,True,148.7,,0.0,0.003067778490524173,0.0,46.02,46.02,1.0,0.0,14.05,14.05,10.76,0.4,2.15,766.0,,,,,,,0.0
BRAGE,8,NORTH,producing,oil/gas,BRAGE UNIT,OKEA ASA,False,,"Brage produces oil from sandstone of Early Jurassic age in the Statfjord Group, and sandstone of Middle Jurassic age in the Brent Group and the Fensfjord Formation. There is also oil and gas in Upper Jurassic sandstone in the Sognefjord Formation. The reservoirs are at depths of 2000-2300 metres. The reservoir quality varies from poor to excellent.","Statfjord, Brent, Viking","Statfjord, Brent, Fensfjord, Sognefjord",clastic,The recovery strategy in the Statfjord and Brent Groups and Fensfjord Formation is water injection. The Brent Group had earlier been produced by water alternating gas (WAG) injection. The Sognefjord Formation is produced by depletion with pressure support from the aquifer.,https://factpages.sodir.no/factpages/default.aspx?nav1=field&nav2=PageView|All&nav3=43651,62.53,4.71,2.85,70.09,1.7,0.35,0.13,2.18,2.8,162.0,22.0,13.0,17.0,5.0,214.0,0.82,0.023,0.386,0.374,0.2141,0.973,0.926,0.972,0.969,1996.0,6.947,6.607,0.341,112.0,69.0,16.0,27.0,60.54255559821428,3.047418758928572,841.7,2171.1,2171.1,2513.4,136.9,2195.7,224.5,348.1,158.1,True,80.6,104.9,1.2647171670323925,0.0036660891012755834,204.88,18.33,223.21,0.08,76.54,3.92,80.46,63.18,1.61,0.56,785.0,2427.0,5796.0,,44200.0,,1436.0,0.0
BREIDABLIKK,9,NORTH,producing,oil,BREIDABLIKK UNIT,Equinor Energy AS,False,,"The main reservoirs contain oil in Paleocene sandstone in the Heimdal Formation, at a depth of 1700 metres. The reservoirs have good quality, with little variation in reservoir properties. Above the Heimdal Formation, oil is present in a sand injectite complex in shales of Paleocene and Eocene age in the Lista, Sele and Balder Formations.",Rogaland,Heimdal,clastic,"The field is produced by pressure depletion, assisted by gas lift in the production wells.",https://factpages.sodir.no/factpages/default.aspx?nav1=field&nav2=PageView|All&nav3=38702206,30.46,0.0,0.0,30.46,30.24,0.0,0.0,30.24,,101.0,2.0,0.0,2.0,0.0,105.0,0.96,0.0,0.302,0.302,0.0,0.007,,0.007,0.007,2024.0,1.125,1.125,0.0,7.0,0.0,0.0,7.0,59.25128242857143,2.6012334285714287,1746.0,1748.0,1748.0,1750.0,126.9,1748.0,179.0,179.0,101.8,False,65.6,19.8,1.058899622671742,0.006012233920974655,106.95,0.0,106.95,0.0,32.25,0.0,32.25,20.73,0.38,2.96,643.0,,,,,,,0.0
BRYNHILD,10,NORTH,shut down,oil,,,True,,"Brynhild produced oil from sandstone of Late Jurassic age in the Ula Formation. The reservoir is at a depth of 3300 metres, and the reservoir conditions are close to high pressure, high temperature (HPHT) conditions.",Vestland,Ula,clastic,The field was produced by pressure support from water injection. Water for injection was supplied from the Pierce field. ,https://factpages.sodir.no/factpages/default.aspx?nav1=field&nav2=PageView|All&nav3=21123063,0.49,0.0,0.0,0.49,0.0,0.0,0.0,0.0,,6.0,0.0,0.0,0.0,0.0,6.0,1.0,0.0,0.082,0.082,,1.0,,1.0,1.0,2015.0,0.255,0.255,0.0,6.0,2.0,2.0,2.0,57.49278449999999,2.3026155,3307.0,3351.8,3351.8,3448.0,81.5,3346.0,341.6,341.6,101.8,False,119.0,278.6,1.761510491335974,0.004240303078967834,10.57,0.0,10.57,0.0,0.86,0.0,0.86,0.55,0.02,0.09,640.0,589.0,407.0,,0.0,,301.0,0.0
BYRDING,11,NORTH,producing,oil/gas,090 B,Equinor Energy AS,False,,Byrding produces oil and gas from turbiditic sandstone of Late Jurassic age in the Heather Formation. The reservoir is at a depth of 3050 metres. It is structurally complex and has good reservoir quality.,Viking,Heather,clastic,The field is produced by pressure depletion.,https://factpages.sodir.no/factpages/default.aspx?nav1=field&nav2=PageView|All&nav3=28975067,0.94,0.54,0.08,1.56,0.05,0.06,0.0,0.11,9.2,8.0,2.0,0.0,1.0,1.0,11.0,0.73,0.091,0.118,0.127,0.27,0.947,0.889,0.951,0.929,2018.0,0.209,0.209,0.0,2.0,2.0,0.0,0.0,61.128242,3.546061,3091.0,3095.5,3095.5,3100.0,361.0,3095.5,316.1,316.1,101.8,False,110.6,125.0,1.3453860662814805,0.004378435532464841,10.76,4.38,15.14,0.29,1.37,1.18,2.55,1.63,0.04,0.82,640.0,2320.0,,,,,431.0,0.0
BØYLA,12,NORTH,producing,oil,340,Aker BP ASA,False,,Bøyla produces oil from sandstone of late Paleocene to early Eocene age in the Hermod Formation. The reservoir is of good quality and lies in a channelised submarine fan system at a depth of 2100 metres.,Rogaland,Hermod,clastic,The field is produced with pressure support from water injection. Gas lift is also necessary to support flow in the wells.,https://factpages.sodir.no/factpages/default.aspx?nav1=field&nav2=PageView|All&nav3=22492497,4.94,0.37,0.0,5.31,1.45,0.09,0.0,1.54,,15.0,1.0,0.0,1.0,0.0,17.0,0.88,0.0,0.329,0.329,0.37,0.706,0.757,0.706,0.71,2015.0,0.833,0.761,0.071,9.0,5.0,1.0,3.0,59.341284,1.8298940000000004,1788.0,2011.2,2011.2,2133.0,119.7,2114.0,216.2,216.2,101.8,False,77.8,66.7,1.168743329370426,0.005319440737285795,17.53,0.0,17.53,0.0,5.77,0.0,5.77,3.71,0.08,0.41,642.0,1388.0,1936.0,,0.0,,1569.0,0.0
COD,13,NORTH,shut down,gas/oil,,,False,,The Cod field produced gas and condensate from deep-marine turbiditic sandstone of Paleocene age in the Forties Formation. Cod has a complex structure with several separate reservoirs at a depth of 3000 metres.,Rogaland,Forties,clastic,The field was produced by pressure depletion.,https://factpages.sodir.no/factpages/default.aspx?nav1=field&nav2=PageView|All&nav3=43785,2.88,7.28,0.99,11.15,0.0,0.0,0.0,0.0,,5.0,11.0,0.0,1.31,9.69,27.0,0.18,0.0,0.576,0.774,0.6618,1.0,1.0,1.0,1.0,1980.0,1.415,0.572,0.843,7.0,7.0,0.0,0.0,57.06946742857143,2.4347111428571426,3126.3,3397.9,3397.9,4660.0,70.0,3199.7,326.7,440.3,137.3,True,114.1,263.0,1.7151819687596364,0.0034950540768011722,8.58,33.85,42.43,0.8,6.63,22.4,29.03,21.53,0.66,3.08,742.0,1079.0,,,,0.38,1553.0,0.0
DRAUGEN,14,NORWEGIAN,producing,oil/gas,093,OKEA ASA,False,,Draugen produces oil from two formations. The main reservoir is in sandstone of Late Jurassic age in the Rogn Formation. The western part of the field also produces from sandstone of Middle Jurassic age in the Garn Formation. The reservoirs are at a depth of 1600 metres. They are relatively homogeneous and have good quality.,"Fangst, Viking","Garn, Rogn",clastic,"The main production mechanism is natural pressure support from the aquifer, with additional water injection from the south.",https://factpages.sodir.no/factpages/default.aspx?nav1=field&nav2=PageView|All&nav3=43758,153.71,3.67,5.51,162.89,8.4,1.94,0.46,10.8,12.4,228.0,15.0,0.0,13.0,2.0,256.0,0.89,0.008,0.674,0.698,0.2447,0.945,0.471,0.944,0.934,2001.0,12.866,12.593,0.274,33.0,20.0,6.0,7.0,64.33959506060606,7.765549818181818,1598.0,1694.4,1694.4,2103.4,261.6,1632.0,167.2,167.2,101.8,False,61.7,57.0,1.1324659331373086,0.0063105607108361024,258.2,12.62,270.82,0.05,180.31,3.09,183.4,118.01,2.03,3.58,643.0,3982.0,9796.0,,64054.0,,2846.0,0.0
DUVA,15,NORTH,producing,gas/oil,636,Vår Energi ASA,False,,The reservoir contains oil and gas in turbiditic sandstone of Early Cretaceous age in the Agat Formation. It is at a depth of 2200 metres and has good quality.,Cromer Knoll,Agat,clastic,The Field is produced by pressure depletion and gas expansion in the gas cap.,https://factpages.sodir.no/factpages/default.aspx?nav1=field&nav2=PageView|All&nav3=34833026,3.48,4.58,1.06,9.12,0.9,3.21,0.74,4.85,,11.0,6.0,0.0,1.0,5.0,18.0,0.61,0.278,0.316,0.413,0.7633,0.741,0.299,0.639,0.468,2023.0,1.67,0.971,0.699,6.0,4.0,0.0,2.0,61.400261333333326,4.067266833333334,2492.7,2515.0,2515.0,2574.7,359.0,2496.2,255.1,255.1,101.8,False,90.6,90.9,1.239137870184072,0.004848176445574204,13.63,24.24,37.87,0.64,5.63,18.5,24.13,15.48,0.36,2.58,641.0,2201.0,,,,1.92,3080.0,0.0
DVALIN,16,NORWEGIAN,producing,gas,435,Wintershall Dea Norge AS,True,,"Dvalin contains gas in Middle Jurassic sandstone in the Ile and Garn Formations. The reservoirs are at a depth of 4500 metres and have high pressure and high temperature (HPHT). The homogeneous shallow marine Garn sandstone has good reservoir quality, while the more heterogeneous and fine-grained Ile sandstone has less favourable reservoir properties.",Fangst,"Ile, Garn",clastic,The field is produced by pressure depletion.,https://factpages.sodir.no/factpages/default.aspx?nav1=field&nav2=PageView|All&nav3=29393934,0.88,31.09,0.75,32.72,0.87,30.37,0.73,31.97,,0.0,47.0,1.0,0.0,47.0,48.0,0.02,0.979,,1.63,0.6615,,0.023,0.018,0.023,2024.0,0.879,0.035,0.845,4.0,4.0,0.0,0.0,65.42943275,7.140168000000001,4193.0,4262.0,4262.0,4341.0,381.0,4257.0,434.4,635.0,148.9,True,149.4,,0.0,0.0030670356439885587,0.0,144.15,144.15,1.0,0.0,95.35,95.35,72.94,2.69,18.24,765.0,,,,,0.58,1775.0,0.0
EDDA,17,NORTH,shut down,oil,018,ConocoPhillips Skandinavia AS,False,,"Edda produced oil from Maastrichtian and lower Paleocene chalk. The main reservoir is in the Upper Cretaceous Tor Formation, at a depth of 3100 metres.",Shetland,Tor,carbonate,"The field was produced with pressure depletion. Starting in 1988, gas from the Tommeliten Gamma field was transported to Edda and used for gas lift in the wells.",https://factpages.sodir.no/factpages/default.aspx?nav1=field&nav2=PageView|All&nav3=43541,4.82,1.98,0.4,7.2,0.0,0.0,0.0,0.0,,16.0,5.0,0.0,5.0,0.0,26.0,0.62,0.0,0.301,0.326,0.396,1.0,1.0,1.0,1.0,1980.0,1.765,1.345,0.42,7.0,7.0,0.0,0.0,56.464702,3.104443714285714,3287.4,3332.4,3332.4,3385.8,70.0,3343.4,341.4,495.0,147.8,True,118.9,312.5,1.8511959638257012,0.003292469524470505,29.62,0.0,29.62,0.0,9.66,0.0,9.66,7.38,0.24,1.05,764.0,345.0,,,,,1189.0,0.0
EDVARD GRIEG,18,NORTH,producing,oil,338,Aker BP ASA,False,,"Edvard Grieg produces undersaturated oil from alluvial, aeolian and shallow marine sandstone and conglomerate of Late Triassic to Early Cretaceous age. The reservoir is at a depth of 1900 metres. The eservoir quality varies from moderate to very good in marine and aeolian sandstone, while the quality is poorer in alluvial sandstone and conglomerate. Oil is also proven in the underlying basement.",,,clastic,The field is produced by pressure support from water injection.,https://factpages.sodir.no/factpages/default.aspx?nav1=field&nav2=PageView|All&nav3=21675433,54.2,5.24,2.79,62.23,14.35,1.3,0.76,16.41,,98.0,12.0,0.0,12.0,0.0,122.0,0.8,0.0,0.553,0.582,0.4367,0.735,0.752,0.735,0.736,2021.0,6.461,5.969,0.491,21.0,14.0,4.0,3.0,58.842728190476194,2.2483557142857142,1857.8,2045.2,2045.2,2972.8,109.0,1894.8,193.9,193.9,101.8,False,70.5,122.4,1.299473405050792,0.00569669050652916,127.35,0.0,127.35,0.0,74.06,0.0,74.06,47.6,0.92,2.27,643.0,2468.0,5751.0,,18083.0,,1666.0,0.0
EKOFISK,19,NORTH,producing,oil,018,ConocoPhillips Skandinavia AS,True,,"Ekofisk produces oil from naturally fractured chalk of Late Cretaceous age in the Tor Formation and early Paleocene age in the Ekofisk Formation. The reservoir rock has high porosity, but low permeability. The reservoir has an oil column of more than 300 metres and is at a depth of 3000 metres.",Shetland,"Tor, Ekofisk",carbonate,"Ekofisk was originally produced by pressure depletion and had an expected recovery factor of 17 per cent. Since then, comprehensive water injection has contributed to a substantial increase in oil recovery. Large-scale water injection started in 1987, and in subsequent years, the area for water injection has been extended in several phases. Experience has proven that water displaces the oil much more effectively than anticipated, and the expected final recovery factor for Ekofisk is now estimated to be over 50 per cent. In addition to the water injection, compaction of the soft chalk provides extra force to drainage of the field. The reservoir compaction has resulted in about 10 metres subsidence of the seabed, especially in the central part of the field. It is expected that the subsidence will continue, but at a much lower rate.",https://factpages.sodir.no/factpages/default.aspx?nav1=field&nav2=PageView|All&nav3=43506,531.49,152.23,30.08,713.8,30.35,1.95,1.37,33.67,7.3,1069.0,286.0,0.0,286.0,0.0,1641.0,0.65,0.0,0.497,0.525,0.5323,0.943,0.987,0.944,0.953,2002.0,20.581,17.838,2.743,424.0,314.0,107.0,3.0,56.54906058962264,3.2167519033018865,1440.0,3201.0,3201.0,3695.9,74.8,3169.9,330.6,491.9,154.9,True,131.1,267.5,1.7442951385129488,0.0034133851442053097,1864.65,0.0,1864.65,0.0,979.54,0.0,979.54,714.24,23.37,1.68,729.0,1630.0,2729.0,,156820.0,,1999.0,0.0
ELDFISK,20,NORTH,producing,oil,018,ConocoPhillips Skandinavia AS,False,,"Eldfisk produces oil from chalk of Late Cretaceous and early Paleocene age in the Hod, Tor and Ekofisk Formations. The reservoir rock has high porosity, but low permeability. Natural fracturing allows the reservoir fluids to flow more easily. The field consists of three structures: Alpha, Bravo and Eldfisk Øst. The reservoirs are at depths of 2700-2900 metres.",Shetland,"Hod, Ekofisk, Tor",carbonate,"Eldfisk was originally produced by pressure depletion. In 1999, water injection was implemented through horizontal injection wells. Pressure depletion and the water weakening effect have caused reservoir compaction, which in turn has resulted in several metres of seabed subsidence. The Eldfisk II project extends waterflooding on the field.",https://factpages.sodir.no/factpages/default.aspx?nav1=field&nav2=PageView|All&nav3=43527,153.99,46.91,10.49,211.39,27.69,4.37,1.6,33.66,13.3,450.0,119.0,0.0,119.0,0.0,688.0,0.65,0.0,0.342,0.366,0.3942,0.82,0.907,0.822,0.841,1980.0,7.666,6.17,1.496,178.0,151.0,26.0,1.0,56.39095933707865,3.2483256235955054,1773.0,2982.1,2982.1,4367.2,71.5,2984.7,304.9,474.0,158.5,True,106.9,264.4,1.7116619356260454,0.00326995026606739,770.25,0.0,770.25,0.0,281.53,0.0,281.53,220.88,6.86,1.24,785.0,736.0,1872.0,,0.0,,849.0,0.0
EMBLA,21,NORTH,producing,oil,018,ConocoPhillips Skandinavia AS,True,,"Embla produces oil and gas from segmented sandstone and conglomerate of Devonian and Permian age. The reservoir is at a depth of more than 4000 metres and has high pressure and high temperature (HPHT). It has a complex, highly faulted structure.",,,clastic,The field is produced by pressure depletion.,https://factpages.sodir.no/factpages/default.aspx?nav1=field&nav2=PageView|All&nav3=43534,12.51,5.73,1.27,19.51,0.36,0.32,0.08,0.76,1.8,49.0,17.0,0.0,17.0,0.0,83.0,0.59,0.0,0.255,0.281,0.3371,0.971,0.944,0.968,0.961,1994.0,1.94,1.512,0.428,7.0,7.0,0.0,0.0,56.333130142857144,3.248257,4389.2,4535.3,4535.3,4684.0,70.8,4518.4,461.0,865.0,191.2,True,158.2,346.9,1.9803222488346677,0.002663178072406628,97.04,0.0,97.04,0.0,27.29,0.0,27.29,22.86,0.96,3.27,838.0,1259.0,,,,,1875.0,0.0
ENOCH,22,NORTH,producing,oil,ENOCH UNIT,Repsol Sinopec North Sea Limited,False,,Enoch produces oil from Forties sandstone of Paleocene age. The reservoir is at a depth of 2100 metres and has variable quality.,Rogaland,Forties,clastic,The field is produced by pressure depletion.,https://factpages.sodir.no/factpages/default.aspx?nav1=field&nav2=PageView|All&nav3=3437659,0.43,0.0,0.0,0.43,0.01,0.0,0.0,0.01,2.0,2.0,0.0,0.0,0.0,0.0,2.0,1.0,0.0,0.215,0.215,,0.977,,0.977,0.977,2009.0,0.072,0.072,0.0,1.0,0.0,0.0,0.0,58.641258,1.552464,2275.0,2275.0,2275.0,2275.0,120.0,2275.0,232.6,232.6,101.8,False,83.2,134.0,1.3417413652936614,0.005097768632260176,2.68,0.0,2.68,0.0,0.58,0.0,0.58,0.37,0.01,0.37,642.0,,,,,,,0.0
FENJA,23,NORWEGIAN,producing,oil/gas,586,Vår Energi ASA,False,,"The reservoirs contain oil and gas in sandstone of Late Jurassic age in the Melke Formation, and oil in Upper Jurassic sandstone in the Rogn Formation. They are in a fan system at a depth of 3200-3500 metres, and have variable reservoir properties.",Viking,"Melke, Rogn",clastic,The field is produced by pressure support from water and gas injection. Produced gas is reinjected into the reservoir. The reinjected gas will be produced at the end of the oil production period.,https://factpages.sodir.no/factpages/default.aspx?nav1=field&nav2=PageView|All&nav3=31164879,6.44,2.57,0.8,9.81,5.75,2.53,0.8,9.08,,16.0,4.0,0.0,3.0,1.0,23.0,0.7,0.043,0.402,0.452,0.6425,0.107,0.016,0.095,0.074,2023.0,0.89,0.837,0.052,6.0,2.0,2.0,2.0,64.03015900000001,6.749174333333333,3419.7,3546.1,3546.1,3836.7,321.7,3497.0,357.0,357.0,101.8,False,124.1,187.5,1.5238984373951658,0.004168066457693393,24.38,4.17,28.55,0.15,11.03,2.68,13.71,8.77,0.25,1.46,640.0,,,,,,1169.0,0.0
FENRIS,24,NORTH,approved,gas,146,Aker BP ASA,True,,The reservoir contains gas and condensate in sandstone of Jurassic age in the Ula and Farsund Formations and has high pressure and high temperature (HPHT). It is at a depth of about 5000 metres and has varying quality.,"Vestland, Tyne","Ula, Farsund",clastic,The field will be produced by pressure depletion.,https://factpages.sodir.no/factpages/default.aspx?nav1=field&nav2=PageView|All&nav3=42002478,10.07,13.99,1.29,25.35,10.07,13.99,1.29,25.35,,0.0,33.0,24.0,0.0,33.0,57.0,0.42,0.579,,0.473,0.4239,,0.0,0.0,0.0,,,,,5.0,0.0,0.0,0.0,56.7014588,3.1349128,1189.0,4401.0,5237.0,5400.0,68.0,5237.0,534.1,971.6,185.3,True,182.2,,0.0,0.0026241760316923378,0.0,86.6,86.6,1.0,0.0,36.71,36.71,30.47,1.34,6.09,830.0,,,,,,,0.0
